{
  "schemaVersion": 2,
  "kind": "engineering-process-controlled-automation-proposal",
  "status": "passed",
  "repository": "example/project",
  "proposalKind": "dependency-update",
  "automationOwner": "renovate",
  "branch": "automation/renovate/update-example",
  "targetBranch": "main",
  "baseSha": "1111111111111111111111111111111111111111",
  "headSha": "2222222222222222222222222222222222222222",
  "title": "chore(deps): update example dependency",
  "bodySha256": "sha256:3333333333333333333333333333333333333333333333333333333333333333",
  "changedPaths": [
    "package-lock.json",
    "package.json"
  ],
  "optIn": {
    "path": ".process/automation-proposals.json",
    "sha256": "sha256:f2c53f92188f3230a9657ef87a19e589697826ca44f2fef177c6d18fb6118c4f",
    "document": {
      "schemaVersion": 2,
      "kind": "engineering-process-automation-proposal-policy",
      "enabled": true,
      "targetBranch": "main",
      "branchPrefix": "automation/renovate/",
      "completionCheck": "lifecycle-completion",
      "allowedAutomationOwners": [
        "renovate"
      ],
      "allowedProposalKinds": [
        "dependency-update"
      ],
      "requiredControls": {
        "automerge": false,
        "scripts": false,
        "plugins": false,
        "shellExecution": false,
        "privilegedCi": false,
        "writeCapableChecks": false,
        "processAuthorityChanges": false,
        "workflowChanges": false,
        "releaseChanges": false,
        "deploymentChanges": false,
        "securityPolicyChanges": false,
        "trustRootChanges": false,
        "upToDateBeforeMerge": true,
        "humanMergeRequired": false
      }
    }
  },
  "verifier": {
    "repository": "example/policy-verifier",
    "commit": "4444444444444444444444444444444444444444"
  },
  "observedControls": {
    "automerge": false,
    "scripts": false,
    "plugins": false,
    "shellExecution": false,
    "privilegedCi": false,
    "writeCapableChecks": false,
    "processAuthorityChanges": false,
    "workflowChanges": false,
    "releaseChanges": false,
    "deploymentChanges": false,
    "securityPolicyChanges": false,
    "trustRootChanges": false,
    "upToDateBeforeMerge": true,
    "humanMergeRequired": false
  }
}
